{
  "evaluation_id": "jev-eval-001",
  "created_at": "2026-09-20T20:00:00Z",
  "invalidated_at": null,
  "workspace_id": "workspace-001",
  "actor_type": "jev",
  "actor_reference": "typesafe-jev",
  "owning_engine": "Scenario",
  "object_reference": "ScenarioVersion:scenario-001:1",
  "question_id": "scenario.readiness",
  "question_version": "1.0.0",
  "threshold_policy_id": "display-only-v1",
  "threshold_policy_version": "1.0.0",
  "requested_model_alias": "jev-latest",
  "returned_model_version": "jev-1.13.0",
  "state_hash": "sha256:aaaaaaaaaaaaaaaaaaaaaaaaaaaaaaaaaaaaaaaaaaaaaaaaaaaaaaaaaaaaaaaa",
  "request_hash": "sha256:bbbbbbbbbbbbbbbbbbbbbbbbbbbbbbbbbbbbbbbbbbbbbbbbbbbbbbbbbbbbbbbb",
  "criteria_hash": "sha256:cccccccccccccccccccccccccccccccccccccccccccccccccccccccccccccccc",
  "source_references": [
    {
      "object_type": "ScenarioVersion",
      "object_id": "scenario-001",
      "version": 1
    }
  ],
  "consent_reference": {
    "object_type": "ConsentRecord",
    "object_id": "consent-jev-001",
    "version": 1
  },
  "consent_purpose": "scenario_readiness_evaluation",
  "minimization_policy_id": "jev-minimization-v1",
  "minimization_policy_version": "1.0.0",
  "input_fields": [
    "scenario.assumptions",
    "scenario.unknowns",
    "scenario.conflicts",
    "scenario.professional_questions",
    "scenario.provenance_status_summary",
    "scenario.deterministic_gate_results"
  ],
  "answer": {
    "type": "score",
    "score": 2,
    "legend": {
      "0": "Not reviewable because material state is absent or contradictory",
      "1": "Early exploration with substantial unsupported assumptions",
      "2": "Reviewable with clearly displayed material unknowns",
      "3": "Ready for owner exploration with sources, assumptions, and limits visible"
    },
    "probabilities": {
      "0": 0.05,
      "1": 0.15,
      "2": 0.65,
      "3": 0.15
    },
    "confidence": 0.65
  },
  "selected_action": "display_signal",
  "authority_effect": "displayed",
  "fallback_reason": null,
  "human_override": null,
  "correlation_id": "correlation-001",
  "causation_id": "command-001",
  "criteria_snapshot": [
    "Not reviewable because material state is absent or contradictory",
    "Early exploration with substantial unsupported assumptions",
    "Reviewable with clearly displayed material unknowns",
    "Ready for owner exploration with sources, assumptions, and limits visible"
  ],
  "external_ai_disclosure_reference": {
    "object_type": "ExternalAIDisclosureRecord",
    "object_id": "ai-disclosure-001",
    "version": 1
  }
}
